subreddit,title,content,upvotes,upvote_ratio,comments_count,author,timestamp,post_id
UnpopularOpinion,The Art of Flirting is Dead,"The Spiderman into the Spiderverse movie moment where the uncle of Miles teaches Miles how to flirt is going to keep living rent free in my head for a long time I feel. 

I think with both guys and girls, the art of flirting has been nigh extinct for a while now. 

Too often guys tell me ""I asked someone out I thought was flirting with me, and they rejected me"" or sometimes, they dont even consider the fact that she literally has not flirted with them at all. They mistake the girl being kind as flirting. 

I think the vice versa is true as well. Often my woman friends express frustration with thinking a guy was into them, only for the guy to pull away or disappear before they can go out, or they start avoiding contact with them. 

I talked with my mom about why neither she nor dad ever taught me how to flirt, and the response was ""we thought you would figure it out"". Unfortunately, I really dont see my peers actually flirting in public, so I never really picked it up from my environment, and like many others, tried weird self help videos and guides etc online to no avail. 

I asked one of my woman friends if guys flirt with her often, and she said no, point blank. Mind you, she is a very attractive person, and goes on dates with guys regularly, and has had multiple long term BFs. She claimed that most of the time, guys would just point blank ask her out on a date with no lead up, or build up beforehand. No little shoulder touches, compliments etc.

And if you are worried about being creepy, just note that flirting almost never is creepy if it only happens once or twice and isnt intense. Huge difference between something light and fun that can be brushed off or reciprocated and like ... actual SA

It feels more and more as time goes on, that the single people around me and online keep getting burned by either misreading flirting, or by not doing it, and that it is the core of having issues getting into a relationship. 

.

Edit: since this post is popping off, and im seeing a lot of comments on it, yea I get that my parents couldn't just ""teach"" me how to flirt lol. I believe there were warnings or things that could have saved my hardest crashes and burns from being as severe though. 

In Jr high, when I was a braindead idiot, I thought flirting was spending as much time as possible with the girl you like, so I followed the girl I liked around as much as possible, found her between classes and followed her around at lunchtime etc. It hit me like a MF TRUCK what I was doing when I was called a stalker by one of her friends. 

Thats something I feel my parents could have warned me about. Thats all I meant by the paragraph about my parents.

.

Edit 2: Okie yall, I guess I forgot to mention that I am fine in the flirting department, I dont need more comments telling me how to do it lol. I feel I do it well, but I keep hearing my single friends complain endlessly about not being able to land dates or whatever, and I always ask how they KNOW the other party is/was interested, and they almost never can give a reason.

Its both guys and girls. I made this post as an unpopular opinion, because I know many people don't feel flirting is essential, or dont feel like it is dying. There is data to back up that more people are lonely than ever before, and I feel thats in-part because they arent learning flirting skills from anywhere.
",3649,0.79,1141,RegaultTheBrave,2024-12-02 09:35:37,1h4xokz
UnpopularOpinion,"“Gentle Closing” doors is the only acceptable method, anything else is inconsiderate ","
If you just let doors close through the physics of swinging it shut, rather than turning the knob to gently place the door into its frame, you have no respect for the people around you. It takes two seconds to properly shut a door, yet nobody does it unless there’s a pressure assist doing it for them. ",977,0.83,196,Zromaus,2024-12-02 12:15:52,1h51l3e
UnpopularOpinion,Warm soda is better than cold,"You get to taste the flavor so much more when it’s a room temperature or higher. There’s no rush to finish the drink before either the ice melts or it gets above the temperature that is acceptable to you. 

No need to fill up your fridge or worry about restocking after you pull one out. Just pile it up in your garage and that’s it. 

Feeling the syrup stick to the inside of your lips and teeth is a great feeling, just a little reminder of the delicious drink you just consumed (I brush my teeth often)

Pairing it with a warm meal is best. No more back and forth of hot mouth to cold mouth. Just a solid consistent temperature that, for me, seems to help with digestion compared to an ice cold drink.",202,0.8,67,ExtendedMacaroni,2024-12-02 19:30:30,1h5bslh
relationships,No Politics!,"Hello! 

This is a friendly reminder that politics are not allowed in this sub and any such posts/comments will be removed as soon as possible. 

Thanks for reading!",35,0.74,0,mew_mew_kitty_kat,2024-10-28 11:14:05,1ge6159
relationships,[F22] my bf (27M) cheated with my best friend (24F) but is more upset about my calm reaction,"**TL;DR**: my bf cheated on me with my best friend, confessed, and now he’s upset because im not reacting emotionally enough. instead of focusing on his betrayal, im focused on quietly planning my exit and moving on with my life.

a few days ago, my bf broke down and confessed that he cheated on me… with my best friend. he was crying, saying it was a mistake, begging for forgiveness, and acting like the world was ending. me? I just sat there, staring at him, feeling… nothing. no tears, no yelling, no heartbreak. just emptiness.

I think I’ve been emotionally checked out of this relationship for a while. his behavior had been off for months canceling plans, being evasive, acting like I was more of a burden than a priority so I’d already started distancing myself emotionally. when he dropped this bombshell, it felt more like confirmation than a shock.

as for my best friend, I’ll deal with her when the time is right. for now, im just done with both of them. it hurts, sure, but I dont have the energy to unpack all of that rn. I’ve got a lot going on im launching a new business, working long hours, and trying to set myself up for a better future. that matters so much more to me than their betrayal.

but here’s the kicker: he’s the one who’s upset. he keeps asking me why im not mad, why im not crying, and if I even care about him. he says things like, “dont u love me enough to fight for this?” and “why aren’t u more jealous or angry?”

I honestly think he’s more bothered by my calmness than he would be if I had screamed and thrown things. it’s like he wants me to make a scene so he can feel less guilty or justify his actions. sorry, but im not giving him that satisfaction.

I’ve already decided I’m leaving. I’ve started looking for a new place to live, and I’m quietly getting all my ducks in a row. rn, I just want peace and to focus on myself, but he won’t stop pestering me about my lack of a reaction. he’s even tried taking jabs at me, saying, “you’re so cold, no wonder this happened.” (srsly???)

I don’t care to fix this. I don’t care to fix him. I just want to get through this with as little drama as possible and move on.

how do I deal with him in the meantime? I feel like im being forced into a battle I don’t even want to fight.",335,0.97,77,MadamMoonlightGalax,2024-12-02 17:31:35,1h598ix
relationships,Resenting my partner now,"I have noticed that my (F36) partner (M35) always makes a comment such as “what do I get” or “you can have that but I want you to do something for me” if I ask for either a favour or he does something for me. 

I just seems like nothing is done from his heart anymore and comes with a price tag. It really makes me not want to ask for anything nor appreciate what he does because I get the “now I want” or “now what do I get” statement. 

I’m really starting to resent him now because of this. 

We both ordered new phones and I noticed that he ordered a screen protector pack that came with 3. I asked him if I could have one of them and he right away says, “you can, but what do I get?” 

Now I just would rather buy my own. 

I don’t know how to handle this at all. I confronted him about it and he gets really angry and defensive and says that I can’t take a joke. 

TL;DR,

My partner always makes a comment such as “what do I get” or “you can have that but I want you to do something for me” if I ask for either a favour or he does something for me.",156,0.93,65,bubble-24,2024-12-02 13:19:13,1h535le
relationships,My husband (33M) just asked me to quit my hobby and say goodbye to my hobby friends. I really don't want to say yes to that. What should I do?,"  
  


A bit of background story. My husband(33M) and I (31F) have been together for almost 8 years, married for 5. For the majority of my adulthood, I have been a bit of a malfunctioning adult in society (have not worked full time since 2015, have not worked at all since 2019) due to my severe depression. I’ve tried various therapy and meds, so far pretty treatment-resistant. Because of these things, my self-esteem has grown lower and lower to the point where I kind of only talk to my husband and have no other friends or family. (Now that I put it in words, it sounds so crazy but true.) My husband has been the only source of support, love, and friendship for the past 2 years or so. I should also mention that my husband is a very private person as well. He’s a big home boy and doesn’t really hang out with friends in real life, either. 

My husband, on the other hand, is a very intelligent person who makes a comfortable amount of money for the two of us. We don’t have kids yet. And we get to take seasonal vacations all over the place. I’ve been of course very grateful for all the hard work my husband has done. As far as my day goes, I do chores around the household and (try to) take care of everything at home. But some days, I just crash and lay in bed all day. My husband has tried to motivate and help me as much as possible to the point where I felt like he’d be better off without me and I’m holding him up for all the dreams he had of building a family and buying a home, etc. 

For the past couple of years, my husband’s approach of helping me has become gradually more authoritarian, almost like an authoritarian parenting style. Before you judge me, yes, i know it’s not the healthiest. But I’ve been so deep in my sad and numb head that I didn’t have the energy to even discuss alternatives. What I mean by him being authoritarian with me is,  for example, he has created a card system where I need to write down what I’m going to do next day (pretty basic household stuff) such as cooking 3 meals for 1h45mins, doing laundry for 1 hr, dishes for 0.5hrs, running 5k for 0.5hr….” etc. He’ll review and approve my agenda for the next day (with a minimum of 6hrs of stuff to do). If I can’t complete the things I said I’d do, he’ll punish me for it in a very parenting way - such as taking away my phone, ipad, game console, locking up my pet bunny, making me run extra miles, etc. I’d naturally resist and object to these commands at first, but over time, I’ve learned that the more I argue with him, the harsher his punishments would be. It’s pretty non-negotiable with him. 

His reasoning is that he’s trying to help me, and if I can’t do the things I promised I’d do, then that means I chose to not do those things and thus chose the consequences. I don’t agree with it, but like I said, I  haven’t really had the energy or will to debate with him when my head was in a bad place. I should also mention that English is my second language, and he’s a native speaker. And he’s a near-genius, I’m just generally smart. So there’s no way I could win arguments with him. 

Yes, I don’t disagree that I haven’t intellectually or socially grown much over the past 5 years at all. On a daily basis, I do consume a lot of social media and entertainment as a way of escaping my reality and coping with my pain. But my husband’s theory has always been “just do it” “just push it through” “it doesn’t matter if you’re tired you get things done anyways”. My husband complains about me consuming “garbage”, and asks me to only listen/read/watch somewhat educational things. I’m sorry I can’t. I just can’t. 

Apologizes for the long paragraphs. I think I’ve painted an overall picture of my marriage. Fast forward to this summer, I discovered an interest in watching table tennis games. I’ve watched a bunch of matches and learned a lot about the players and stuff. About a month ago, I met some fellow table tennis fans on a very friendly online platform (“小红书“ in Chinese), and quickly made some very good friends there. There’s one table tennis player I like a lot, so I kind of started a fan page on that social media platform. I’ve been talking to fellow fans daily, I’ve edited photos and videos for my posts for fun. This has been my painkiller for the last month. I’ve actually been extremely happy that I met some of the girls there. There’s one in particular which I’ve had lots of deep talks with, about life, marriage, politics, etc. I’ve been a bit of a social magnet there. I’m funny, creative, and very fun to talk to in the online world in my native language. But of course, all these things I’ve been doing behind my husband’s back. Why? Because he thinks watching sports is not helpful, and being a fangirl is a bit stalking-ish. So I’ve just told him that I’ve made some PingPong friends online and no more than that. 

Needless to say, I’ve spent a lot of my time on my PingPong friends and this fan page. He thinks I’m too addicted to it and I should quit it cold-turkey. He asked me to do it earlier today and was surprised that I didn’t want to say yes right away. Here’s why I don’t want to say yes to that, 1) this good friend I made online was the first close friend I’ve made in the last 8 years. Most of my friends are Chinese like me, my American husband doesn’t like that. He dislikes the fact that I consume a lot of Chinese stuff instead of English because we live in America. I really really don’t want to let go of this awesome person who’s become a good friend of mine. Because again, I don't talk to anyone besides my husband in real life. 2) I actually have this sociable and likeable online persona. It’s the first time I’ve felt like the old self in over a decade. It might be pitiful, but I actually have a good sense of self esteem in that safe and friendly pretty much all-female online community. It’s the happiest I have been for however long. I really don’t want to say goodbye to this. 

It feels to me that every time I discover something that makes me happy, my husband would take it away from me as a punishment of not getting the things done which I said I would. I know I’m pretty spoiled. I have never fully financially supported myself ever. But I don’t know, this just doesn’t feel right. My husband has complained about me not growing intellectually or cognitively, about me “regressing”, me being childish, spoiled, about me making excuses for things etc. They’re probably all true. 

Please be bluntly honest with me here. I just turned 31. I have nothing to show for. I’ve pretty much cut off contact with my family who deserve a much better daughter than me. I have no savings or money. I’m trying to build my life from where I am. I’m so lost in life. But I look around, I only have him. So I think I need a second opinion on things. Thanks for reading all of my rambling. 



\----------------------------------------------------------



\*\*TL;DR;\*\* :My husband and I have been very unusually codependent because of my depression. I usually say yes to everything he tells me to do. But this time I really don't want to. What should I do?

",850,0.86,155,throwaway691656,2024-12-01 23:39:32,1h4nz7s
TrueAskReddit,What’s the difference between a dumb person and a stupid person?,,1,0.67,3,R3dF0r3,2024-12-02 21:41:43,1h5edej
TrueAskReddit,Call Control cancelation,"I downloaded this app, Call Control, to block spam numbers. I get voicemails all the time even when a number is blocked and this app is supposed to fix that. I subscribed for a 7 day trial, and now I'm trying to cancel and it's impossible. When you look up how to cancel, it just says to find cancelation under settings. Guess what I can't find? Anything that remotely says cancelation, manage subscription, or any version of anything that could possibly cancel. I see online other people also wanting to cancel but no solution posted. Anyone successfully canceled this thing? I even went into my Google account manager and it isn't listed under my subscriptions there so maybe they just own me now?",0,0.38,1,LittleNightBright,2024-12-02 15:43:28,1h56pbg
TrueAskReddit,Would you get up for a women on public transport ,Note the women us mid 40s not pregnant nothing like that just a normal women asking fir your seat,0,0.44,64,United-Combination53,2024-12-02 09:32:04,1h4xllq
TrueAskReddit,Why do we laugh at the weak?,"As far as I can remember, whenever I go on social media there is always a clip that is viral of someone getting offended by something minuscule to which people laugh at and say “this offended generation”, “these snowflakes”, “people are so weak nowadays” and so on.

For me it is not laughable, it saddens me seeing somebody get so crazy about something. I always think what has happened in the life of somebody that mentally they are so weak? Nobody is born mentally weak, the world and life makes us like that. 

So now my question is, why do we laugh at those people? Why don’t we empathise as society and give those individuals the help they need? If people hate seeing other weak individuals, why do we let people get weak and then hate them for that same weakness? If weakness is such a hated trait wouldn’t it be ideal to eradicate it as a whole?",10,0.59,40,Theo04t,2024-12-01 04:48:33,1h40rep
Confession,I’m having an abortion this weekend and I’m terrified but I’m not ready to be a mom again. ,"I’m married and I recently had a baby this year. We are going through a lot right now and another baby wouldn’t make sense. I feel guilty but I think that every child deserves a good life and I can’t provide that right now. I just got over my postpartum depression and I don’t want to go through it again. I have to focus on myself, my baby and my husband. I hope God forgives me. I hope that I’m making the right decision.",1579,0.7,2421,justawoman24,2024-12-02 12:06:06,1h51ccl
Confession,I don’t think it’s worth being a good person anymore ,"So here’s the thing, I’m a good person and I know it. I always do the right thing, I’m kind, I’ll put myself into shit situations to help others. I’m the one everyone always calls for help, I don’t judge, I’m just good. 

I feel like everyone takes advantage of me, and I’m sure I let them. I get lied to, cheated on, lied to again, used. And for what? For me to have the benefit of the doubt for these people. I’m a big believer that people can change, but it’s at my cost. I’m the one who gets destroyed in the end. 

I’m tired, I don’t want to be nice anymore, I don’t want to be understanding, I don’t want to be kind. I don’t want any of it. I want to be left the fuck alone, because when I’m alone there’s no one to hurt me. ",121,0.86,98,SunshinyMews,2024-12-02 09:55:01,1h4y4pw
Confession,I’m a dirty person and forget it’s not normal……………,"I just went out with some friends and they parked at my apartment.
They were going to get an Uber home but came inside to smoke real quick. I didn’t really think much of the state of my place but they lost it and made jokes the whole time about how dirty it was. Didn’t even want to sit down anywhere or hangout, I could tell the wish they never came inside. I do struggle with depression and that’s a big part of it. I feel so exhausted by the smallest tasks sometimes. I personally didn’t  think it was that bad but I also know I’m used to it because this was also how I grew up. I want to change don’t get me wrong it’s just hard to break a cycle. Just feeling so embarrassed  and lost.",1626,0.91,510,weepwillow17,2024-12-01 19:01:53,1h4islc
Confession,"I write smut to work on my SA trauma and guilt, but can't tell anyone","I have an issue with being judged and shame. That comes from my childhood. Then I was SAd and it made it even worse. I stopped writing at all, even the most innocent stuff, because I could not stand someone finding it and reading it. And even when writing, I kept imagining somone I knew reading and reacting in real time.

I am in therapy and it's some progress. I was post therapy session with that weird lucidity when I decided I was going to write an erotic scene and be shameless about it. On a notebook, for myself, to write about something no one ever will read. Everytime the thought of someone else reading it came up, I ignored it with all the willpower I had.

I ended up writing a hell long and detailed story, which is not even the worst thing you will find on wattpad if we are being honest. I'm sure many would consider it pretty vanilla. Still I felt so scandalized when I read it again later. 

But I guess it's progress? I am writing, I am not judging myself and I am letting myself explore a side of me I repressed so long out of fear... So yeah I can't tell this to people and needed to let it out. And NO I won't post it anywhere. I have the notebook hidden better than it would be an actual sex toy. 

But maybe one day I'll get to feel normal about this part of my life and not a total wreck.",30,0.8,17,Altruistic_Ferret951,2024-12-02 16:00:26,1h5740o
