subreddit,title,content,upvotes,upvote_ratio,comments_count,author,timestamp,post_id
AskReddit,What was your “I’m dating a fucking idiot” moment?,,2327,0.93,1584,post-nutclarence,2024-11-30 17:29:46,1h3pfcx
AskReddit,"What's a story where the ""bad guys"" are actually, completely, 100% right, to the point where it's weird the story keeps calling them the bad guys?",,12041,0.94,7688,WidowofBielsa,2024-11-30 07:19:00,1h3cex6
AskReddit,What made you lose a significant amount of weight?,,945,0.94,2075,ExilicRose,2024-11-30 18:43:38,1h3qyip
AskReddit,What song is torture to you?,,489,0.91,2310,KingStevoI,2024-11-30 18:19:26,1h3qgt3
ChangeMyView,Meta: r/changemyview is recruiting new moderators,"It's that time of the year folks. We're looking to expand our team of volunteers that help keep this place running. If you're passionate about changing views through thoughtful discourse, what better way can there be to contribute to that than help to keep a community like this as a smoothly oiled machine? We're not looking for a fixed number of new moderators, generally we like to take things by eye and accept as many new mods as we have good applications. Ideal candidates will have...

* A strong history of good-faith participation on CMV (delta count irrelevent).

* Understanding of our rules and why they're setup the way they are.

Please do note though:

Moderating this subreddit is a significant time commitment (minimum 2-3 hours per week). It's rewarding and in my opinion very worthy work, but please only apply if you are actually ready to participate.

Thank you very much for making this community great. The link to the application is [here](https://docs.google.com/forms/d/e/1FAIpQLScsLvIvt7ghitVONvLUNtxsyK-KCPhtPUdtaIo0SHmzg-PP8A/viewform?usp=sf_link)",9,0.58,34,RedditExplorer89,2024-11-27 23:58:46,1h1pb0h
ChangeMyView,CMV: Liberal democracies are decaying into illiberal democracies or democracies in name only,"For a democracy to thrive it needs the following (among others):

* A population that agrees on facts: Therefore, channels of information (e.g., podcasts, social media, and traditional media) need to be able to distribute fair and accurate information to the public.
* A population that is informed of their civic duty and is willing to honor them: This means that political participation should be enabled as much as possible e.g by making voting as easy as possible, but most importantly by making education much more than just preparation for a job, but more about how to function as a participant in a society where democracy is the political system
* A political system that is not corrupted by money and special interests: i.e. shouldn't be allowed to buy votes or pay (donate to) politicians to pass favorable legislation.

Around the world, all of the above points are being undermined for example in the EU one of the vice presidents of the EU parliament was arrested for accepting bribes from Qatar, see here: [https://www.politico.eu/article/mep-kaili-charged-with-corruption-by-belgian-prosecutors-reports/](https://www.politico.eu/article/mep-kaili-charged-with-corruption-by-belgian-prosecutors-reports/)

There are many examples of the lack or deterioration of the above basic requirements in numerous places hence my view is that liberal democracies will eventually only be democracies in name only in the future unless we find a way of fixing the :

* information sources so that people can agree on the facts
* Voting is made easier and people understand their civic duty
* Remove corruption from politics.

Edit:

I would also like to add that this is the key reason for the results in the US, I believe that their democracy has decayed so much as to give outcomes that make no sense given the facts of the contenders. ",279,0.78,146,kindly102,2024-11-30 09:55:33,1h3fhh0
ChangeMyView,CMV: Most people don't understand the conflict in Syria because it's not a bipolar war,"By most people I'm referring to the understanding of the conflict in the global scope. Because of the recent events in Ukraine and Israel, a lot of people see the world as a bipolar system now (the United States and NATO versus Russia, China, Iran, and North Korea). In some ways, that is a correct interpretation. Ukraine is the US/NATO and it's allies supporting Ukraine against Russia which is being supported by North Korea and Iran. Israel being supported by the US/NATO against Hamas and Hezbollah, proxies of Iran and allies of Russia. However Syria is not that simple.

At first glance, most people think it's the Russia/Iran backed Assad regime against the US/NATO backed rebels, part of this is true. Assad is indeed a close ally of Russia and Iran, but the rebel situation is much more complicated. Mainly there's the SNA and the SDF, the SNA is a decentralized coalition of different rebel groups which range from fairly moderate to literally Al Qaeda, and the SDF is essentially a Kurdish force in the northeast. Both sides have received some support from the US/NATO in the past, but don't get much anymore. When Trump backed out of Syria in 2019, Turkey and the SNA took control of SDF occupied territory, but the SDF then received help from Assad's government. Turkey is a NATO member of course but the Kurdish SDF was a key NATO ally in defeating ISIS, a group that is obviously not well liked in the West but also still fighting Assad's regime. 

That was a very condensed summary of the Syria conflict, but it illustrates the point kind of, people saying ""the rebels must be supported by Israel or the US because they might soon topple Russia and Iran's allied government"" are somewhat misguided, because although that would make sense in a bipolar system, Syria is not a bipolar conflict. Even though this is largely happening because Hezbollah and Russia (Assad's key allies) are dealing with other conflicts, it doesn't mean that the mostly Islamic fundamentalist rebels taking control of Syria is in the interest of the US, NATO, or Israel, even though those rebels are directly supported by a NATO member, Turkey. 

TL;DR, the conflict in Syria has too many competing groups for it to fit in the bipolar cold war net that Ukraine and Israel are already in, so this has led to a lot of people online making a lot of misinformed commentary about the conflict. ",57,0.79,37,maybemorningstar69,2024-11-30 17:10:32,1h3p1cu
ChangeMyView,CMV: It becomes easier to change someone's mind if you use things that they like ,"It's my first time posting here, so don't be mean please, I genuenely want to hear a different perspective to my current belief 

But anyway: let's say hypothetically that you have someone who thinks women are all inferior. This guy really dislikes women. Let's call him Joe.

The worst thing you can do, is send a woman to talk to Joe. Joe will not listen, and he will be very annoyed.

But If you send a man that Joe deeply admires, Joe will listen to that person. And slowly, Joe will be a little bit more open to accept women, because you used something that he likes.

You know, for example when children hate broccoli, but eat it when it's mixed with cheese or something they like.

Sure, Joe may never respect women regardless of anyone's effort. Joe might just be like that forever.

It is not our duty to change his mind, but... It would make It easier? What do you think?

My personal experience: there was a really racist classmate during my time in highschool. Terrible dude. But he really liked the history teacher, and the teacher was always talking about respecting others regardless of skin color. Nowadays, this dude is an adult and is pretty much normal and has apologized for his past.

Another thing: the sandwhich method. people use It all the time. Compliment, criticize, compliment. That way, people are more inclined to agree with you, because you stroked their ego a bit, while also making them grow as a person.

",24,0.82,35,Only-Gur9840,2024-11-30 18:04:25,1h3q5ic
TodayILearned,"TIL Since the World Chess Championship started in 1886, there has only ever been one instance of the title being won by a checkmate, back in 1929.",,11628,0.97,337,OperationSuch5054,2024-11-30 18:34:42,1h3qs0r
TodayILearned,"TIL about Philippine Airlines Flight 812. A passenger hijacked the plane and robbed the other passengers. He tried escaping using a homemade parachute, but he couldn't jump and needed a flight attendant to give him a push. He was killed after his parachute failed to open. Everyone else was unharmed.",,22713,0.97,449,Ill_Definition8074,2024-11-30 15:17:44,1h3mmi1
TodayILearned,"TIL that in world war 2, English soldiers would use passwords that had sounds that the language of the people they where fighting against did not have, so that they could tell if an unidentified person was an enemy soldier tying to infiltrate them by if they said these sounds correctly.",,3956,0.95,615,Bizzy_Dewdrop,2024-11-30 21:32:13,1h3u5ez
TodayILearned,"TIL In the 80s, there was a panic over reports that 1.5 million children per year being abducted in the US, but it turned out to be just bad record keeping.",,24088,0.96,824,NickDanger3di,2024-11-30 11:53:30,1h3i5gm
self,"My grandmother sponsored a Native American child in the 70s. In a box of letters we have from the family of the child, this is the most heartbreaking one","My mom told me that as a kid she always looked forward to hearing from the young boy that my grandmother was sending gifts and money to. I finally dove into the box of letters a while back and this one still haunts me. 

I looked it up and found a newspaper article confirming the events. I do not want to share any info about the family because there are still living members.

Here is the letter:

https://imgur.com/1UfcLig

Transcribed:

""Dear Mrs. X,

This is a thank you letter from [child], sorry we could not answer back sooner, but a tragic thing has happen in the family a few days before Christmas [child]'s father shot his mother, it was an instant death but the kids missed her terribly especially the little one. Now the kids are living with their grandmother, she took them in right after her daughter's death, it has been unpleasant Christmas remembering that just a few days before she was anxious for the package that you send to the kids, she was really happy when she saw the gift and she ask me to write back for [child] right away but I decided to wait awhile not knowing she didn't have very long to live, your gift has help the kids to take their mind off their mother, we all did love her she was the jolly type of person always ready with a smile and a joke.

We all wish you a very happy x_mas and new Year,
I am [child]'s aunt my name is [name] and 21 years of age. I'll be glad to correspond for the kids because I love them and want them to be happy, I left out some things that I feel are important to type down.

So once again thank you for the wonderful gifts it has been deeply appreciated.

Sincerely,

[personal information]""

I feel like crying again writing this all out.

edit: I know a lot of people in the world are suffering right now. Native Americans are often left out of the public eye in that case. They are still here. This is just one of many stories. The reservations are not easy places to live. 

Native American charities: https://www.charitynavigator.org/discover-charities/best-charities/indigenous-peoples-native/",1684,0.97,32,thenonefinemorning-,2024-11-30 15:05:59,1h3mdjd
self,My partner got us matching rat plushies and I'm gonna sob ,"He randomly messaged me asking if I wanted a large rat then sent a picture of the cutest rat stuffed animal I've ever seen. He then sent another picture of him holding two of them so we could have matching ones and ""if we hold their hands at the same time it's like we're holding hands"". 

I am an adult, I do adult things, I am an adult who almost cried at my partner buying us matching rats. 


I can't post the pictures here but I posted the conversation which has the rat plushies in them earlier if anyone is curious enough. ",127,0.99,12,a-packet-of-noodles,2024-11-30 23:00:21,1h3vp8q
self,The bane of this generation is loneliness ,"Holy shit in the most connected world I’ve never felt so alone. My wife gets upset when I talk to any female (even those in our D&D campaign), I get ugly looks and comments if I hang out with my male friends to long on discord. I’m in a city I didn’t grow up in, with no friends or family besides my campaign party and those I meet online. In a world that is so connected why do I feel alone? Is this a collective issues or am I just spiraling. Sorry to ask Reddit for help. Someone ground me please.  ",103,0.95,20,artwithtristan,2024-11-30 23:16:38,1h3vzt9
self,I’m a millionaire and it cost me everything,"37M. Recently hit this milestone after committing myself to my career for the last 15 years. I thought just focus on you, build the future you’re envisioning and the rest will fall into place. Man was I wrong.  The only thing I have is my career. I’ve completely lost myself along the way.

I’m sitting alone in my apartment as the holiday weekend gets under way. Watching the city come to life as I feel I slowly succumb to the opposite force. My friends are all with their families and loved ones, most have small children of their own. Everyone is rightfully consumed with their family and close friends - I just don’t fit-in in most of those settings anymore. 

I could absolutely go out on my own, so I’m not throwing a pity party, it just doesn’t sound appealing to me. 

I’ve given up my hobbies as I never had time for them the last decade, or they no longer interest me. I am unable to find love - some blame is certainly my own in this category but still feels like it’s been a gauntlet. And now most of the available women my age have baggage, kids, etc. Not exactly exciting. 

My friends who I grew up with look at me differently now that I’m successful. There is resentment. I went to intense graduate school and post-grad training during my twenties and  early thirties, I grew apart from and lost touch with many good friends.

I used to be incredibly extroverted and could talk to a wall. Now, not only does small talk and interacting with people seem pointless, I’ve realized I can barely keep a conversation anymore. Interaction with people is a task now, and usually a disappointing or at best unremarkable occurrence in my day. 

I’m a shell of my former self. I don’t have anything to offer anyone other than money. And that’s a worse feeling than having no money, which I’ve also experienced. 

In my tireless journey for success, I lost my humanity and there is no worse poverty to experience than that of connection. 

I hope this finds you well, and I implore you to nurture your connections. Love your family and spouse. Be present with the ones that matter. Lean into your friendships. There is no higher calling as a human than to brighten the world of those you love. That’s real wealth. 

In a world that’s obsessed with status and appearance, achievement and comparison, chasing these vague axioms will lead to a life of emptiness and regret. Be thankful for what you have and for those you love.  It’s the only currency that matters. 



Edit: the intent behind writing this was a cautionary tale to the young professionals and young adults, caution that trying to fulfill yourself and find meaning in life through accomplishment and finances alone will not suffice. To cherish the friends and family you’ve got if you’re lucky enough to have them. Many young people driven to achieve are running from something in their past, I was. it isn’t a valid coping mechanism, and I’m humbly realizing that now. 

I also want to recognize the spectrum on which suffering occurs. I assure you I am aware of how my situation doesn’t hold a candle to most of human suffering. I’m not looking for pity and I appreciate the interaction with this post, even the negative comments have value to me. Be well, all. ",19177,0.8,5930,deebmaster,2024-11-29 21:25:12,1h33ffu
offmychest,We have persistent scammers preying on this community,"Folks, a reminder that [Rule 3](/r/offmychest/about/rules) focuses this community's scope on providing emotional support only. We do not allow solicitation or material offers.

This means OPs cannot hint at or ask for money, and community members cannot offer money or food. There are local services that can verify and address a person's situation better than any of us can (and many services will not turn people away if they are asking for it). A kind community member offered a scammer a job and that is okay.

This community is read by millions of people, and scammers around the world know this. We have cultivated an empathic community so we know it can be hard to resist offering material help. It takes only one person to make it worth it because it costs nothing to post. That is why the rules are strictly enforced.

There are many signs of a scammer. They will present a financially desperate situation often with a highly emotional component. They are likely to mention payment services. They may have payment services in their Reddit profile and ask people to look at their profile. They will ask people to privately message them. All of these behaviors may be obfuscated with weird spacing and other ways to evade detection. If they evade detection it's up to the community to report it. Do not call out OPs, report only.

Thank you for your cooperation.",1233,1.0,73,AutoModerator,2022-04-14 22:00:13,u3ydaq
offmychest,i think my delayed flight might have saved my life,"i had been planning to take my life tonight when i got home. i wanted to wait to see my family, wait until after the holidays. i had the whole plan for weeks. i had said goodbye to my family today after having spent some wonderful days with them, and had planned to go say goodbye to the person i love when i landed. 

however, by some freak chance, my first flight got delayed and i missed my connection home. there were no other flights tonight. i now fly out tomorrow morning early as fuck. 

at first i was angry, then sad, then defeated. but maybe this is something in the universe trying to give me another chance. maybe i should take it. ",1383,0.99,65,savvyleigh13,2024-11-30 20:48:52,1h3tcf3
offmychest,Nurses laughed at me and it made me happy when they panicked ,"So this is just a rant because it bothers me. I ""won"" in the end but I don't really know who talk to about this. But I just gotta get it off my chest how happy i was to be proven right.

So I went to the ER because I had a fever I couldn't get down and felt like I couldn't breathe. When I approached the counter and explained what was going on two nurses who were sitting behind her snickered and laughed. One said to the other in a low voice ""She could at least try harder"" and the nurse at the counter rolled her eyes, smiled and said ""Okay sweetie well you can breathe okay"" I'm not really sure why they responded that way. Maybe I looked like someone else? But it took them 2 hours to check my temp and blood pressure and when I approached they gave me attitude. Only to find out I had a temperature of 104, low blood pressure, a heart rate of 148, and my oxygen level was at 85. The lady said ""Did you drive yourself here? You must be having a hard time breathing."" I looked at her and said ""Crazy right? It's almost like it's almost like it's why I came here"" 

I'll be honest I did get a satisfaction of seeing their response! I got admitted shortly after and was hospitalised for a bit. But man I got so happy seeing the fear in their eyes!",330,0.99,23,UnreasonableRaisin,2024-11-30 23:52:25,1h3wkr6
offmychest,I hate my down syndrome sister in law,"Here is the thing. Three years ago my parents in law got covid and they died at the same time. It was really sad and difficult  for my husband and me. The moment they passed away we had to bring my sister in law to live with us and care for her; she's got down syndrome and I had to re-educate her because my in laws thought she couldn't do anything. I literally had to teach her to say thank you and please and to do many things she is perfectly able to. Anyways, life has not been easy with her at home. My husband and I never get to be alone (we had only been married for a month when this happened), we have to plan everything in advance to accommodate to the fact that she's here. She goes to an adult school 5 hours a day but other than that she's always and I mean always here and it makes me mad. Sometimes I just want my house for myself. She can be very annoying and in general it's just difficult to have here around all the freaking time. Anyways, I literally just needed to get it out of my chest.",1966,0.97,117,frustratedcaregiver,2024-11-30 10:47:03,1h3gn02
Showerthoughts,"200,000 years of humans, and we left the planet for the first time 62 years ago. We're in the beginning.",,1705,0.92,250,tsivdontlikereddit,2024-11-30 22:28:22,1h3v52f
Showerthoughts,The universe is so big that light speed isn't nearly fast enough to actually get us anywhere in a intergalactic scale.,,2962,0.93,268,elpsychox,2024-11-30 18:41:49,1h3qx7a
Showerthoughts,Vampires would likely be able to use a garment similar to a burqa to go out in the day.,,5014,0.96,200,gayjemstone,2024-11-30 05:59:03,1h3b40i
Showerthoughts,Empathy is as much an evolutionary benefit as survival of the fittest.,,152,0.88,37,sproots_,2024-12-01 00:20:49,1h3x12w
personalfinance,New to /r/personalfinance? Have questions? Read this first!,"# Welcome!  Before making a post, please check out some of the great resources that we've provided to answer your questions:

## We have a simple guide answering most questions about what to do with money and how to prioritize your finances: **[Click here: How to handle $](http://www.reddit.com/r/personalfinance/wiki/commontopics)**.

## We have a wiki covering dozens of topics: credit, debt, retirement, investing, and more: **[Click Here: Personal Finance Wiki](https://www.reddit.com/r/personalfinance/wiki/index)**.

## We have age-specific guides too!

### [15 to 20?](https://www.reddit.com/r/personalfinance/wiki/teachme)

### [18 to 25?](https://www.reddit.com/r/personalfinance/wiki/young_adult)

### [25 to 35?](https://www.reddit.com/r/personalfinance/wiki/early_career)

### [35 to 45?](https://www.reddit.com/r/personalfinance/wiki/mid_career)

## Also be sure to check out our regular series:

### [Weekday Help and Victory](https://www.reddit.com/r/personalfinance/search?q=title%3AWeekday+author%3AIndexBot&restrict_sr=on&sort=new&t=week#res-hide-options)

### [Weekend Help and Victory](https://www.reddit.com/r/personalfinance/search?q=title%3AWeekend+author%3AIndexBot&restrict_sr=on&sort=new&t=week#res-hide-options)

---

## __[When posting here, please treat others with respect, stay on-topic, and avoid self-promotion.](https://www.reddit.com/r/personalfinance/about/rules)__",11,1.0,0,IndexBot,2024-11-16 07:00:02,1gsmr61
personalfinance,"Weekend Help and Victory Thread for the week of November 29, 2024","### If you need help, please check the [PF Wiki](https://www.reddit.com/r/personalfinance/wiki/index) to see if your question might be answered there.

This thread is for personal finance questions, discussions, and sharing your success stories:

1. *Please make a top-level comment if you want to ask a question! Also, please don't downvote ""moronic"" questions!* If you have not received your answer within 24 hours, please feel free to [start a discussion](http://old.reddit.com/r/personalfinance/submit?selftext=true).

2. *Make a top-level comment if you want to share something positive regarding your personal finances!*

**A big thank you to the many PFers who take time to answer other people's questions!**",1,0.6,12,IndexBot,2024-11-29 15:00:02,1h2vpsj
