subreddit,title,content,upvotes,upvote_ratio,comments_count,author,timestamp,post_id
LetsNotMeet,What Belongs Here,"I'm getting real sick of people getting shitty over their stories being removed, so here's a list of stories that inarguably belong here. If you read this thread and you have a story, compare it to any of these. If it wouldn't fit in with this list of stories, *it does not belong on this subreddit.* Usually if you're not sure if a story belongs here, it doesn't. 


1. [They stalked all the stay at home moms](https://www.reddit.com/r/LetsNotMeet/comments/7bhjfl/they_stalked_all_the_stay_at_home_moms) - I don't think I need to explain why this fits. I know there is some skepticism in the comments, but as OP was interactive with them prior to deleting her account (typically creative writing pieces OP doesn't respond to many, if any, comments), I think it's okay to leave up. 

2. [This happened quite a long time ago yet it is never too far from my mind](https://www.reddit.com/r/LetsNotMeet/comments/gi7emq/this_happened_quite_a_long_time_ago_yet_it_is) - this fits because although OP made it out unharmed and nothing really happened, the insistence of ""coming up here"" and the fact the creeper left *surgical shears* where they are not needed pushes this story into ""out of the ordinary"" 

3. [No good deed goes unpunished](https://www.reddit.com/r/LetsNotMeet/comments/1g3x4f/no_good_deed_goes_unpunished) - Here is an example of a car story that would actually remain up. It takes place almost entirely in the car, but it is not someone just following her, or road raging and she goes home physically unharmed. This would be terrifying to go through. (Side note: this is also one of my favorite stories of all time as I love it when assholes like this get their due comeuppance) 

4. [I was a victim of sex trafficking](https://www.reddit.com/r/LetsNotMeet/comments/p1bmel/i_was_a_victim_of_sex_trafficking) - this is a real story about actual human trafficking. If you ""think"" you escaped human trafficking, most likely you didn't. Human trafficking overwhelmingly does not happen the way most people think it does, the reality is truly insidious and horrifying. 

5. [The office in the middle of nowhere](https://www.reddit.com/r/LetsNotMeet/comments/1t2uwq/the_office_in_the_middle_of_nowhere) - I don't think I really need to explain this one either, I just wanted an example for the ""found something creepy/bizarre"" category. 


As a reminder, stories posted in this subreddit should have been life threatening (stories 1 and 3), extremely unusual/uncommon (stories 2 and 4) or about a time when you stumbled upon something excessively creepy (story 5). 


# What does not belong here? 

* You *think* you were followed because somebody was acting weird but you didn't interact much, if at all and eventually they either gave up or you lost them with minimal effort on your part (so didn't have to hide/confront them) 

* You can't say for certain what someone's intentions were, you can only guess at what they were doing or planning. 

* Being harassed/stared at/catcalled. I understand how frightening and enraging this is, but if you're a woman and you live in any moderately sized city or larger, you will have experienced this. It's entirely too common to be worthy of a story here. That doesn't change the fact it's threatening, disgusting, disrespectful behavior, but this subreddit is meant to focus on, again, life-threatening encounters.
 * an additional note here: stories containing excessive detail about your personal appearance will be removed, even if they fit the standards for this sub. It's a harmful belief to perpetuate in multiple directions that only conventionally attractive people get creeped on - anyone can be harassed on the street. Oftentimes what you look like has little, if anything to do with it, it's the loser's complete lack of regard and view of you as a person and (and for women, lack of respect for us) that causes them to harass you. If our appearance mattered that much for it, 11/12 year olds that look very much like children to anyone with an ounce of brain matter would not get catcalled. 

* The encounter didn't happen to you, but happened to your mother, sister, father, friend, aunt, etc. 

I reserve the right to edit this post to add/remove stories as I see fit, as well as adjust formatting. I suppose we could use this post as well for any comments/suggestions for the sub, cuz why not.

Edit: if you're just gonna bitch that this sub is tOo StRiCt you're wasting your time. Nothing in that regard will be changing.",202,0.99,31,fortunesoulx,2024-02-20 08:29:14,1aviy1c
LetsNotMeet,My hellish neighbours who ruined a year of my life. ,"No one believes me (f25) when I tell people about what I went through last year with my hellish neighbours. 

I had a baby at an inopportune time and me and my partner, who I'll call, Gavin (M30), hurried to buy a house and get everything sorted. We found an inexpensive upstairs flat (if your British you'll know exactly what kind, an upstairs council four-in-a-block).

Upon moving in, we were confronted by some leftover belongings from the last owners, namely, a cross and a small plastic bottle of holy water (I swear this story is real). I figured the last owners were religious and it was just a little gift. Bit weird, but fine.

First two weeks were relatively uneventful. The downstairs neighbours I figured were on holiday, but about day 15, the music started.

I'm fairly easy when it comes to noise disturbances, takes a lot to bother me. After dinner, a loud rumble engulfed the house, and this insanely creepy choir/violin music filled the air. 

It looped for about seven hours, over and over. In the morning, we popped over and asked the neighbours,  a middle-aged couple, to keep it down late at night, as we had a baby, they agreed, were a bit weird, but only faint alarm bells were ringing at this point.

It goes on, and on. Gavin worked nightshifts so it was just me in the house with the baby most nights and I was too scared to confront them. I can honestly, still hear that song now, as I write this from a nice toasty, noiseless home. 

It kept getting worse, and coupled with that we began hearing odd groaning. We assumed they were a little, alternative in their private time. At this point, I joked that they were in a satanic cult (spoiler alert: bad jokes often end up being true).

Then one morning, I woke up to loud screaming. The wife was out, as her motorbike was gone and I hadn't heard her for weeks. I can only vaguely recall it, and for a while I thought I was merely dreaming it. It was loud, visceral and seemed to tear at the air and came in concert with the screaming of an angry man. 

When Gavin got in from his nightshift I asked him to help me call the police, as more frightening than the screaming from downstairs, was the silence that had come after. Gavin at this point, decided I had post-partum depression, and rather than call the police, he advised I speak to my health visitor. 

I was depressed at this point, but it wasn't due to my new motherhood, it was the constant creepy music. But then I supposed, perhaps I was going crazy, I started to actually believe they were satanists and that they were doing weird rituals downstairs.

The CIA uses noise to torture people and I was suffering the same. I was on maternity leave, I was in the house most of the day, and I was losing my mind, and now, after the screaming I was terrified. 

A nice old couple lived in the block opposite, and when they asked the couple rather firmly to keep it down, they were threatened with bodily harm. 

It went on for months. Gavin and I decided to work toward selling and we made the decision to avoid police reports, as these would have to be declared when selling. 

As months pulled by, they just kept getting weirder. There were pumpkins in their garden filled with offal from the butcher, they just threw entire pies in their yard, and were always fighting, breaking things and from the sounds of it, throwing furniture. 

Gavin went down one night after they started playing weird throat singing that was particularly loud, and this time, for some reason, the gentleman took him inside of their house to explain why the music had to be so loud. 

His wife, Ursula we'll call her, ran a spiritual business and summoned demons. The music was part of the ritual. They belonged to an organization called the Order of the Nine Angles, which upon my research is a neo-nazi satanic cult reasonably popular in the UK. 

She took clients (explains the groaning) and made money from it. Gavin describes their house as being littered in satanic stuff, pentagrams, ceremonial daggers, candles, pitch black. 

Low and behold, the throat singing continued. At this point, we're terrified, so we gather our things and seek refuge in my MIL's house and hasten our efforts to sell. Gavin likes to joke, that worse than seeing all of the demon stuff, was realizing that I had been right all along and not paranoid.

At some point, the downstairs neighbour gets arrested for having a trunkfull of machetes, couple this with the fact the O9A are currently being considered as a terrorist organisation, it's downright terrifying. 

We manage to sell the place, and I just feel awful. For two reasons, someone else will have to suffer like me, and I've willfully hid the bonkers neighbours, and secondly, I keep thinking of that screaming... that awful, gutteral scream, and the cold quiet that came after.

I also keep thinking about why they took Gavin into the house. He emphasIzes that he told them I was waiting upstairs, was this what dissuaded them from doing something else? That I was listening with a phone easy to grab? Or did they simply mean to threaten him with the daggers on their walls? 

I left the crucifix and the holy water in a drawer. It was all I could do. 

So, creepy neo-nazi satanic neighbours, let's not meet again. ",59,0.87,7,CelebrationCandid363,2024-11-30 14:36:46,1h3lqno
LetsNotMeet,"He Lived in My House...
","Hi, this is the first time I’m sharing something here, so I hope my story will be easy to understand (by the way, this isn’t my account).

For privacy reasons, I won’t give my name or age.

For a bit of context, this happened about two years ago, a few weeks after my little brother was born. Ever since we moved into this house, there’s been this small room in the basement that’s always locked. To show you how little anyone uses it, I don’t even know what’s in there, but I’ve always assumed it’s just utility stuff like meters or something. The room is really tiny, barely big enough to lie down in.

Now, let’s get into it. My parents went away for a weekend together, leaving me, my older sister, and my baby brother (who was just a few weeks old at the time) at home. My parents trusted us to take care of ourselves since they’d done this before. Anyway, that night my sister went out with friends and wasn’t planning to come back until 4 or 5 in the morning. I watched a good movie and, since it was already getting late, I decided to put my little brother to bed in his room upstairs. I did that and came back down to watch another movie, but I ended up falling asleep.

About two or three hours later, around midnight, I woke up to these strange noises coming from upstairs. At first, I thought it was just the neighbors since they can be pretty loud and the walls are thin. But then I looked at the time and realized it was too late for them to still be awake, let alone making that kind of noise. So, I got closer to the stairs to investigate, and just as I was about to go up the first step, I heard the sound of something metal falling on the ground. Guess what? It was the key to the small room in the basement.

I immediately grabbed my phone, and instead of calling the police, I texted my friends to tell them what was happening. One of my friends had the brilliant idea of calling the police for me. Suddenly, I heard the bathroom door slam shut. I knew it was that door because it makes a very specific creaking noise when it closes. I remembered my brother was sleeping upstairs, so I carefully went up to check if he was okay. Thankfully, he was fine.

Still not fully grasping how much danger I was in, I went to the bathroom door. Since it opens inward, I decided to violently push it open—and I heard a man scream. I immediately shut the door and held it closed to keep him from getting out. He broke the window, and outside the bathroom, there’s this sort of balcony—not a proper one, but you get the idea—that connects to the balconies of the neighboring houses, which are all really close together. He used that to escape.

I grabbed my brother in my arms, ran to the kitchen, and noticed that one of the knives was missing from the knife block. I picked up another knife and crouched in a corner of the living room, crying like never before. The police arrived, and I opened the door for them.

When they searched the house, they confirmed that the bathroom window was broken, and I had hit the guy so hard that there was blood on the floor. But the most shocking and traumatizing part was what they found in that small basement room. There were blankets and cans of food. They concluded that he had been living there for several days...

That’s it. I hesitated a lot before posting this because it really affected me, and I’m sorry if the story isn’t super clear—some of the details are still jumbled in my head. Anyway, I hope you found it interesting!",48,0.98,4,david_mstk,2024-11-30 10:34:47,1h3gd3c
SelfImprovement,"For me, there is only one way to overcome depression","Hi everyone, firstly I would like to say that I am happy and proud that you are following this subreddit because you are actively trying to improve your life and most importantly yourself.

This shit is not easy. Whether you’re doing fine but just want to make small improvements or you feel like you’ve hit rock bottom. It is very difficult honestly but I commend all of us for trying and seeking out help, motivation, joy, and a better life. Joy should be normal. We do not have to hold on to bitter feelings, self hated, negativity, and pain to “glow up” 

With this being said, the only thing that is getting me out of an over one year hellacious depression is putting love out into this world. This is extremely difficult for me because after all the hell I have been through even though I thought it would never happen to me, I became bitter. I became a person who couldn’t feel joy. I became numb. I couldn’t even cry. I couldn’t even smile. Honestly it felt like strong demons were constantly trying to steal my life force and the beauty of life from me. 

But I want you to know how I feel right now. If I and you continue to hype up our “weaknesses”, hate our “faults”, and magnify issues to the point we think the whole world is against us; we will not get to experience what we all long for. And that is: relief, gratitude, being proud of ourselves, feeling love, giving love and many other things that life has to offer. 

Let me tell you, both my parents were alcoholics and drugs addicts and my mother drank while I was in womb, I was neglected and abused as a child with the most painful wounds being the psychological torture, I have experienced SA, I have experienced being degraded, mistreated, lied to, cheated on, scammed, thrown away and many other things. 

However I have also experienced what it’s like to experience success, love, care, feeling proud of my accomplishments etc etc. But for over a year now I have mainly felt resentment, nostalgia of the good days, and toxicity. But then I realized that nothing is changing because I am only adding fuel to the fire of the hell I’ve put myself through. 

I can’t control anyone else. I can’t control the state I live in (FL) (PS: I don’t recommend it, find you a montainy more beautiful state if you can), I can’t control random bumps,blockades, or obstacles in the road. However, I can prepare myself to put my joy as the top priority. I can control not being like the people that hurt me. I can control putting the work in to seize my day. And you can too. 

Don’t ever let anyone steal your joy you hear me? Not even yourself. If human beings have made it this far with many catastrophes, that should let you know that you can as far as the dreams you have and then even further. You wouldn’t believe the opportunities that come from letting this bitterness go. Us letting the pain poison us is not doing anything to the ones who made us suffer. Most people that hurt people just don’t give a fuck. 

I think the most powerful tool is leading by example in terms of being the person you would admire. Because most of the time, the abusers feel real embarrassed once they see they didn’t convert you into being like them. And even if you bettering yourself doesn’t make them feel anything, the people and opportunities that come from being the love you put out will be 1000000x more fulfilling.

With all the negative shit we see on social media, I know it’s hard to believe there is a bright side. But the truth is, do whatever you can to see it. Even if it’s just a sliver. We have to allow healing and forgiveness so we can experience the opposite of what most of us have experienced. Which is a lot of bullshit. The world isn’t over and neither is our lives. 

Apologize to yourself and if you want, apologize to others or do so in your head if they have you blocked. 

I hope that my post has given you hope from the hope I feel from the power of letting go from resentment. I truly believe that a lot of people who read this lives will be changed. Not because of me nor for me but because you the reader have decided  enough is enough. I send peace and love vibes to you guys. Drop a comment sharing your stories and if this helped you in any way.",108,0.98,6,anaglizzy,2024-11-30 19:48:10,1h3s7td
SelfImprovement,I care too much about how people perceive me. ,"I feel small compared to others, and I’m anxious around other people. 

I’m scared I’m going to say something stupid, which will make others perceive me worse. 

I feel that if I stay more quiet, I won’t say something stupid. 

I’m always thinking about my posture, tone, and eye contact around people.

I always feel like everyone is watching me, waiting for me to mess up. 

I feel like the spotlight is on me all the time when I’m out in public and it stresses me out.

I feel that people can feel my anxiety. 

I want to be more confident and think less about how I think other people think of me, but I don’t know how to turn it off. 

Why do I care about all this? Why does all of this matter to me so much? Why can’t I just be comfortable with myself and not worry about how others perceive me?
",320,0.99,64,Chilly_Days,2024-11-30 09:10:57,1h3ek8w
SelfImprovement,I want to be happy being alone,"Slightly depressing post, but feeling somewhat hopeless.

I have slowly come to the realisation that we live in a world in which not everyone is paired up. For some, such as myself, it isn't possible. 

My challenge is I crave connection. I have friends, but they have their own lives and families. I cannot rely on them every time I feel lonely because that wouldn't be fair and I believe eventually they will 'drop' me because I do not fit their lifestyles and will just be the sad third wheel.

How can I become happy with my own company?
How can I go to gigs/new countries without this overwhelming sense of loneliness?
How do I plan for a future where it is just me?

Appreciate any guidance I can get!",81,0.96,45,Mr-Silly-Bear,2024-11-30 15:44:56,1h3n7hi
SelfImprovement,This changed my life — 9 hrs/day to 2 hrs/day doom scrolling,"I'm embarrassed to admit it… but I've been averaging 9 hours a day on my phone for a while (mostly Reels)… I got an iPhone when I was a sophomore in high school, and I think I've been addicted ever since...

Honestly it didn't even feel like that much. It just kind of happens…

* Wake up: scroll (1+ hr)
* Eat breakfast/lunch: on my phone (1+ mins)
* Evening: watch TV while on my phone (3 hrs)
* Lay down for bed: scroll (1+ hrs)
* Wake up in middle of night: scroll (1+ hrs)
* Plus using throughout the day (2 hrs)

I got serious about cutting back, and it's changed my life... it's been reminding me of simpler times growing up... I don't think I've felt this much peace of mind since before I had a phone

If you are anything like me, all I can say is... I wish I did it earlier

Here are the three things I changed:

* **1) Turn on grayscale:** It's annoying… but it seriously works. Makes your phone way less addicting and boring to use. I set up an automated schedule using my phone settings.
* **2) Set hard app limits:** After one hour of social media, I can't open it no matter what. I also keep social completely locked from 7am-7pm.
* **3) Find better replacements:** This was a important one. Replace scrolling with simple things you'd rather do (for me: read, play guitar, call friends, etc). Even just ""watching TV"" without double screening is a better replacement for me... I can actually enjoy the show and get some real relaxation from it.

**Bonus:** how to set an automatic schedule for grayscale:

* Schedule grayscale to kick in certain times of day (on iOS)...
   * Open the native **Shortcuts** app
   * Go to **Automation** and tap **+** in the top right
   * Select **Time of Day** → **Sunset**, tap **Next**.
   * Tap **Add Action (or ""New Automation"")**
   * Search for **Set Color Filters** → Select it
   * Confirm **Color Filters On**, then tap **Next**
   * Toggle off **Ask Before Running** → Confirm **Don't Ask** → Tap **Done**.
   * Set automation to ""**Run Automatically**"" so you don't have to approve it each time
   * (then repeat a schedule to turn it off each morning at sunrise)",190,0.96,12,notta-musician,2024-11-30 10:46:35,1h3gmn2
