subreddit,title,content,upvotes,upvote_ratio,comments_count,author,timestamp,post_id
AskReddit,What's the most random skill you have that never fails to impress people?,,2371,0.95,1833,HippyFlix,2024-12-02 14:50:08,1h55dx4
AskReddit,"What is your favorite ""poor"" person meal?",,947,0.93,3627,NewInvestigator1059,2024-12-02 16:01:38,1h57565
AskReddit,What is your biggest regret from your 20's?,,449,0.95,1185,bigchungusman12,2024-12-02 19:39:33,1h5bzbj
AskReddit,"What's a 'positive' trait society praises, but it's actually toxic?",,383,0.91,455,BaddieZoeee,2024-12-02 19:52:05,1h5c8b0
ChangeMyView,Meta: r/changemyview is recruiting new moderators,"It's that time of the year folks. We're looking to expand our team of volunteers that help keep this place running. If you're passionate about changing views through thoughtful discourse, what better way can there be to contribute to that than help to keep a community like this as a smoothly oiled machine? We're not looking for a fixed number of new moderators, generally we like to take things by eye and accept as many new mods as we have good applications. Ideal candidates will have...

* A strong history of good-faith participation on CMV (delta count irrelevent).

* Understanding of our rules and why they're setup the way they are.

Please do note though:

Moderating this subreddit is a significant time commitment (minimum 2-3 hours per week). It's rewarding and in my opinion very worthy work, but please only apply if you are actually ready to participate.

Thank you very much for making this community great. The link to the application is [here](https://docs.google.com/forms/d/e/1FAIpQLScsLvIvt7ghitVONvLUNtxsyK-KCPhtPUdtaIo0SHmzg-PP8A/viewform?usp=sf_link)",7,0.56,44,RedditExplorer89,2024-11-27 23:58:46,1h1pb0h
ChangeMyView,CMV: The people who entered the capital on jan6th are terrorists and should be treated like terrorists. ,"I need help... I'm feeling anxious about the future. With Joey’s son now off the hook, I believe the Trump team will use this as an opportunity to push for the release of the January 6 rioters currently in jail. I think this sets a terrible precedent for future Americans.

The view I want you to change is this: I believe that the people who broke into the Capitol should be treated as terrorists. In my opinion, the punishments they’ve received so far are far too light (though at least there have been some consequences). The fact that the Republican Party downplays the event as merely “guided tours” suggests they’ll likely support letting these individuals off with just a slap on the wrist.

To change my mind, you’ll need to address what is shown in this video: [https://www.youtube.com/watch?v=-DfLbrUa5Ng&t=2s](https://www.youtube.com/watch?v=-DfLbrUa5Ng&t=2s) It provides evidence of premeditation, shows rioters breaking into the building, engaging in violence, and acting in coordination. Yes, I am grouping everyone who entered the building into one group. If you follow ISIS into a building to disrupt a government anywhere in the world, the newspaper headline would read, “ISIS attacks government building.”

(Please don’t bring up any whataboutism—I don’t care if other groups attacked something else at some point, whether it’s BLM or anything else. I am focused solely on the events of January 6th. Also, yes, I believe Trump is a terrorist for leading this, but he’s essentially immune to consequences because of his status as a former president and POTUS. So, there’s no need to discuss him further.)",290,0.63,596,Imthewienerdog,2024-12-02 20:10:54,1h5cmbq
ChangeMyView,CMV: communal living should be more mainstream to combat unaffordable housing ,"For most of human history, we always lived with a tribe or village. It only changed in the last 300 or so years. And I don't think it's working. All over the globe, it's getting harder and harder to be able to get a mortgage for a house. 

The nuclear family unit is not working as well. It takes a village to raise a child. Asking just mom and dad to raise children with not much from the local community is putting to much on their shoulders. 

I have been thinking rather then buying a house for a nuclear family, and take on stress paying the mortgage. What if small communities get together, everyone pitch in towards the mortgage. The healthy look after the children and elderly. Just like our ancestors did.

The only drawback is loss of privacy and some level of freedom. But if it means having closer relationships with other humans, and having more people to help you raise your kids, it might be worth it imo.

Thoughts? 
",40,0.79,56,itinerant_gypsy,2024-12-02 20:47:50,1h5dcef
ChangeMyView,CMV: Forced conscription is inherently wrong,"This is a topic that recently came up again in the context of the Ukraine war so here's my take: Forcing people into frontline service is inherently and always immoral. I have a few reasons for believing this 

1. Sending someone into war with 2 weeks of training is very likely to get that person killed. So knowingly doing so is essentially equivalent to manslaughter

2. It's a violation of bodily autonomy

3. The state should serve the people and not the other way around. The reason why a state exists is to enable large numbers of people to live together in relative peace and prosperity. A state that puts it's own existence above the lives and welfare of its citizens should not exist ",133,0.6,757,jet_vr,2024-12-02 03:59:09,1h4rlyl
TodayILearned,TIL that up to half of the current Cherokee nation can trace their lineage to a single Scottish fur trader who married into the tribe in the early 1700's.,,19665,0.97,505,Wyrdeone,2024-12-02 14:37:19,1h552q9
TodayILearned,TIL Osama bin Laden's brother died by (accidentally) flying an airplane into a power line,,3528,0.98,173,reCaptchaLater,2024-12-02 18:16:15,1h5a84d
TodayILearned,TIL: That when cast as a child prostitute in the movie Taxi Driver; Jodie Foster had to undergo psychiatric assessments and was accompanied at all times by a social worker on set. Her older sister Connie acted as her stand-in when it came to sexually suggestive scenes.,,3003,0.97,105,appalachian_hatachi,2024-12-02 18:58:43,1h5b4n7
TodayILearned,"TIL Hulu removed a Golden Girls episode in 2020 after a scene where Blanche and Rose, wearing mud masks, joke, “We’re not black,” during a plot about Dorothy’s son marrying a Black woman. Though not blackface, the scene was misinterpreted. The episode was restored in 2023 after a review of context.",,3904,0.96,251,ObjectiveAd6551,2024-12-02 17:04:50,1h58mo9
self,A guy asked my number on the train ,"He just made a bit of friendly conversation and then asked. But I'm a teenager and he was probably late twenties. I told him I'm sorry but I'm in 12th grade, and he was so apologetic and honestly so respectful. Kind of a surprise lol. He said I looked at least 24 and I mean, I purposely dressed older because I was traveling alone and felt more comfortable that way. Of course I didn't think I looked THAT much older... anyways. I guess it just made me more hopeful about men in general, compared to a few weird interactions I've had recently. ",2567,0.9,388,justaspark77,2024-12-02 06:39:26,1h4u18t
self,I did it. I (45M) left her (52f). ,"I'm not sure why I'm feeling compelled to get this out into the world, but here it is. 

I started dating my best friend about 3 months ago. Before getting romantic, this person was my #1 go-to confidante for over 10 years. She was who I called when things were at their worst...she really was my 'ride or die' as they say.

When I decided to rent my house out and spend a year as a digital nomad, she indicated her interest in me and we decided to see what would happen if we tried dating. 

Initially it was pretty great. Especially the first month...it was pretty blissful. But, I knew the luster would wane eventually. I just didn't think it would happen like this. 

We started arguing a few weeks ago. Within seconds, a peaceful evening alone together would erupt into a bitter, no-holds-barred insult fest, and I knew this couldn't be sustainable. 

Then, one night about a week ago, after one such argument, she physically prevented me from leaving the house by blocking my car in with hers and refusing to move it. 

I've never been so terrified of my partner. My lover. My best friend. 

I knew in that moment that I had to engineer a way out of this, or it would only get worse. 

And so, after we returned from our Thanksgiving trip together, in the wake of yet another argument over something minor, I grabbed my keys, packed my things, and left. 

This happened yesterday, and I'm steadily driving farther and farther west, into the desert, where I am going to be alone for a few weeks while I reorient myself and figure out what I'm going to do next. 

It just sucks because not only have I lost a romantic relationship, but now my best friend is an enemy, and that hurts much more. 

The open road calls...so with a heavy heart, I push forward. 

I hear Arizona is beautiful this time of year. 

",401,0.9,87,Fistbump,2024-12-02 14:29:56,1h54w9l
self,I had a very mature interaction with someone hitting on me.,"I (24f) was at a house party last weekend, where I didn't know anyone except the person who invited me. There was lots of loud music and dancing and I met some cool people. Because of the loud music you had to get really close and kind of talk into people's ears to be heard. I chatted with one guy (32m) a lot and he seemed nice, then we parted ways to go to different floors. Later that night we bumped into each other again, danced some more and then he put my arm around his waist and told me he finds me very attractive. I told him that I am in a relationship, and stepped back. He said what a shame, apologized, smiled and we went our seperate ways again. It was such a mature interaction, just the way such things should be handled, I'm still thinking about it just because it was so wholesome. I just wanted to share that between all the crazy stories we hear online.",308,0.83,90,TemporaryPangolino,2024-12-02 13:18:01,1h534id
self,"23F here, none of the men in my age group are dating. What is happening?","I've known these men since highschool, none of them misogynistic and all of them well-educated and most likely liberal, yet... They just aren't dating. From when they were in highschool, to college, and now trying to begin a career... I am also sure if they have a chance at getting a girlfriend they would do it, yet they don't.

My personal theory is they are scared of rejection, being seen as creeps, or maybe they don't think they are worth dating when I think they are. I think this is a big problem in Gen Z, we don't know how to date.",9917,0.79,12488,AYAYAcutie,2024-12-01 20:00:03,1h4jylj
offmychest,We have persistent scammers preying on this community,"Folks, a reminder that [Rule 3](/r/offmychest/about/rules) focuses this community's scope on providing emotional support only. We do not allow solicitation or material offers.

This means OPs cannot hint at or ask for money, and community members cannot offer money or food. There are local services that can verify and address a person's situation better than any of us can (and many services will not turn people away if they are asking for it). A kind community member offered a scammer a job and that is okay.

This community is read by millions of people, and scammers around the world know this. We have cultivated an empathic community so we know it can be hard to resist offering material help. It takes only one person to make it worth it because it costs nothing to post. That is why the rules are strictly enforced.

There are many signs of a scammer. They will present a financially desperate situation often with a highly emotional component. They are likely to mention payment services. They may have payment services in their Reddit profile and ask people to look at their profile. They will ask people to privately message them. All of these behaviors may be obfuscated with weird spacing and other ways to evade detection. If they evade detection it's up to the community to report it. Do not call out OPs, report only.

Thank you for your cooperation.",1233,1.0,73,AutoModerator,2022-04-14 22:00:13,u3ydaq
offmychest,My boyfriend spoiled the Christmas present he got for me and it made me cry,"We were sending reels to each other on Instagram before falling asleep last night. Out of the blue he(28M) told me he has always been terrible at hiding surprises and wanted to tell me (27F) what he got me. This is our first christmas together and he already knows what I'm doing for him so I figured why not, and I don't mind surprises.
He gave me the opportunity to guess, and gave me the hint that it was something that could not be wrapped. Ideally I'd like for him to be here since we are long distance for now but I was pretty stumped aside from that as a possibility.
He then sent me a screenshot for a private horseback trail ride for 2. I was overcome with emotions because for the first time in my life I found someone that quietly listens. I never explicitly said this was something I wanted but he saw my interests. He saw the things I got excited about and found something we could experience together and is *excited* to do these things with me.
I will admit I've not made the smartest choices with past potential partners but this one....I think I'm gonna keep him forever.",824,0.98,25,Embarrassed-Editor12,2024-12-02 11:48:25,1h50w9h
offmychest,I don’t want to live in America anymore. ,"Everything is a contest for insecure dudes. Who has the biggest truck. Who can have the most pro-second amendment shit on display. All these people are tough skin deep. Anytime you challenge any of them, they bend over and apologize. 

Everyone is so fuckin hateful and angry here. Our political discourse has become about owning the other side, and not helping anyone. We actively try to make people’s lives harder because it makes us feel better. It’s fuckin disgusting. 

Everyone acts so tough here and hates everyone else, yet the majority of us are a paycheck away from financial ruin. We’re just constantly brainwashed into thinking each other is the problem. Women can’t live in certain states without risking their lives if their pregnant, all because the American version of Christianity/conservatism is closer to the National Front and KKK than it is to literally anything in the Bible. 

Fuckin over it. I used to love this place, it’s becoming something I don’t even recognize. And I live in a blue state. ",313,0.83,66,cali-bi-guy,2024-12-02 16:04:35,1h577po
offmychest,My brother has rejected me on/off all my life and this year he didn't invite me to the family Thanksgiving until hours beforehand.,"I grew up the youngest of 3 siblings. They were both 8+ years older than me so they were used to bossing me around. 

Growing up, my brother shut himself off from the family. He would on rare occasions, invite me to play video-games with him or take me to a movie with his girlfriend but usually he was just yelling out for me to come close his door or shut off his light when he was too lazy to get up. Me, wanting to be a people-pleaser, did it. 

As we aged, he became the ""funny guy"" and now he has lots of friends in his circle who all love him and think he's the greatest guy on the planet. I'm still a shy quiet reserved guy. He has no problem using me as the target of his jokes, or just plain ignoring me at family get-togethers. 

After years of this, I realized I was never gonna have his acceptance as a peer, and I just stopped caring about having any kind of relationship with him. 

A cruel trick of the universe is that he ended up having a child (my niece) who I love. Of my nieces/nephews (counting my sister's kids too) she's possibly the one I get along with the best. I'm married and don't live super-far away but still too far to see my nieces/nephew frequently, so I started scheduling days every couple months where I could take my niece/nephew (my sister's son) to an arcade or movie or other activity. My sister was okay communicating with me and communicating when my nephew was too busy. When my niece was busy, my brother was either rude about turning me down, saying something like ""she's going out of town"" and ignoring my follow-up questions, or just plain out ignoring me. (The last time I tried to schedule a day, I received no response back. My sister-in-law immediately spouted ""I didn't reply to you!"" the next time I saw her so they hadn't missed it.....I hadn't realized my niece has expensive ballet lessons that day and ignoring me was less of a hassle than letting me know she's unavailable)

For my niece's birthday in August 2024, we ended up going to a restaurant with some of my brother/sister-in-law's friends. My brother didn't want to pay for everyone so he told us all to pay separately. I offered and paid for my mom, dad, sister, and nephew. (practically half the party) We went to the circus afterwards and my brother rudely told me to move because we had to make room for some of his friends in the section and he ignored me when I asked him to repeat himself. 

For Thanksgiving 2024, I had spoken with my mom who made it clear my brother was planning dinner. She had asked him if I'd been invited and my brother had just shrugged and said his wife is inviting people. I told my Mom I hadn't received an invitation. The day before Thanksgiving, I spoke with my mom and she said Thanksgiving was on. I repeated that I hadn't been invited. My mom had brought it up to my brother and sister-in-law, who said that they had invited me a long time ago. My brother told her to invite me again. 

The day of Thanksgiving, my brother sent me an invitation in the morning saying the dinner plans. I told him I was aware my mom had asked them more than once to invite me but I had never received any word. I already had other plans. My brother said ""*His wife* sent it to the wrong person! See you for Christmas!"" I did not reply. 

Thanksgiving night, my sister tried calling me twice and my brother tried calling me once, probably because my mom suggested for them to call me as a group to wish me a happy holiday. I ignored the calls. My brother just sent me a text saying ""call your mother."" I ignored it. 

A few months ago, my sister-in-law had invited me and my wife to go watch my niece in a ballet recital. It's scheduled for this Saturday. I would love to go and see it, especially as my niece had even called me to talk about how excited she is for the role, but I feel like I'd just be rewarding my brother after I was snubbed from the family Thanksgiving and didn't even get an apology. I'm leaning towards not going, and I feel like I'd look silly even showing up for Christmas at this point.",336,0.98,44,TheCrazyMonk,2024-12-02 13:36:09,1h53krz
Showerthoughts,We only have an average of about 80 summers to enjoy. ,,553,0.91,130,Little-Carpenter4443,2024-12-02 19:26:49,1h5bq2d
Showerthoughts,"Since sausages are ground-up meat stuffed into intestines, eating a sausage temporarily turns you into a sausage.",,2525,0.95,73,SexySwedishSpy,2024-12-02 11:09:28,1h4zxkd
Showerthoughts,Rumpelstiltskin's job got a lot harder after people could record him saying his name.,,346,0.97,13,Sujjin,2024-12-02 18:32:08,1h5akdb
Showerthoughts,"200,000 years of humans, and we left the planet for the first time 62 years ago. We're in the beginning.",,10720,0.92,825,tsivdontlikereddit,2024-11-30 22:28:22,1h3v52f
personalfinance,"30-Day Challenge #12: Get involved with charity! (December, 2024)","# 30-day challenges

We are pleased to continue our 30-day challenge series. Past challenges can be found [here](https://www.reddit.com/r/personalfinance/wiki/30daychallenges).

This month's 30-day challenge is to **Get involved with charity!** As the end of the year approaches, there are many opportunities to extend oneself to be generous. The best advice is to ""secure your own oxygen mask first"" before helping others. The foundation of your generosity should be a [solid financial footing for yourself](https://www.reddit.com/r/personalfinance/wiki/commontopics). Until you have achieved this, you should be circumspect about monetary giving.

# Monetary donations

If you have the means, consider monetary donations as these are the most efficient use of your charitable resources. Don't spend money to buy material goods that you intend to donate unless they are specifically requested by the charity itself. Cash donations allow for flexibility for the charity to get exactly what is needed at the right time in the right quantity at the right place to serve their mission.

Make sure you are contributing to charities that are good stewards of your hard-earned dollars by checking [Charity Navigator](https://www.charitynavigator.org/), [Give Well](https://www.givewell.org/), or another trusted source. If you do decide to donate cash, see if your employer matches contributions to extend the benefit. You may also consider donating to a charity that has assisted you or your loved ones in the past.

# Material donations

December is a great month in which to declutter your home, especially if you are participating in one of the many gift-giving holidays. Review your living space to determine what you can part with and how you can enjoy the reclaimed space. You can donate material goods to [Habitat for Humanity](https://www.habitat.org/), [Goodwill industries](https://www.goodwill.org/), [AmVets](http://amvets.org/), and local options near you such as food pantries.

# Time donations

Of course with all the donations coming in at this time of year, many organizations will need volunteers to help with the influx. If you are unable to donate money or material goods, you can consider donating your time. You can use [Volunteer Match](https://www.volunteermatch.org/) or [Catch a Fire](https://www.catchafire.org/) to get you started. There may also be local soup kitchens, churches, schools, or other organizations that need assistance.

# Alternative donations

There are other ways to be charitable if you don't have spare money, goods, or time. Here are some ideas:

* When making Amazon purchases, use the [Amazon smile program](https://smile.amazon.com/gp/chpf/about/ref=smi_se_dshb_aas_saas) to donate a portion of your purchase to a designated charity at no additional cost to you.
* Check with your local markets and grocers to see if they have programs such as [Kroger’s Community Rewards](https://www.kroger.com/topic/kroger-community-rewards-3) to direct donations to local charities.
* Keep an eye out for local restaurants and cafés that will donate a percentage of proceeds to charitable organizations, and patronize them during an eligible time period (schools are frequent beneficiaries of such programs).
* The [Make-a-wish foundation](http://wish.org/ways-to-help/giving/airline-miles), the [Red Cross](http://www.redcross.org/donations/ways-to-donate/donate-airline-miles), and [Miles for Migrants](https://www.miles4migrants.org/) all accept donations of airline miles.
* You may be able to donate hotel or resort points. Contact the relevant hospitality group for details.
* You can elect to donate credit card rewards to charity.
* If your health and personal philosophy allow, consider becoming a blood/plasma donor or [registering for bone marrow donation](https://bethematch.org/). You can also consider registering as an organ donor and revising your will to donate your body to research after you pass.

# Taxes

Qualified charitable contributions remain [tax-deductible under the new tax law in the US](https://turbotax.intuit.com/tax-tips/charitable-contributions/charitable-contributions/L6ZyAXJ4Y), but realizing a reduction in taxes is more difficult because of the increase in the standard deduction. If this is a significant factor for you, you may want to consider more advanced tax reduction strategies such as [donor advised funds](https://www.reddit.com/r/personalfinance/comments/996iam/an_analysis_of_charitable_giving_using_donor/), [giving appreciated stock](https://www.philanthropy.com/article/Donors-Often-Overlook-Benefits/152705), or [bunching your donations](https://www.nolo.com/legal-encyclopedia/itemize-bunching-tax-deductions.html) to meet the itemization threshold.

# Receiving charity

If you are in need this year, please consider being the good-faith recipient of a charity's assistance. 

# Challenge success criteria

You've successfully completed this challenge once you've done one of the following things:

* Donated money, goods, or time to a charity or organization.
* Made an alternative donation or plans to donate.
* Received charitable assistance if in need.",6,0.8,1,IndexBot,2024-12-01 07:00:07,1h42rbg
personalfinance,"Weekday Help and Victory Thread for the week of December 02, 2024","### If you need help, please check the [PF Wiki](https://www.reddit.com/r/personalfinance/wiki/index) to see if your question might be answered there.

This thread is for personal finance questions, discussions, and sharing your success stories:

1. *Please make a top-level comment if you want to ask a question! Also, please don't downvote ""moronic"" questions!* If you have not received your answer within 24 hours, please feel free to [start a discussion](http://old.reddit.com/r/personalfinance/submit?selftext=true).

2. *Make a top-level comment if you want to share something positive regarding your personal finances!*

**A big thank you to the many PFers who take time to answer other people's questions!**",2,1.0,31,IndexBot,2024-12-02 05:00:03,1h4sg3o
